{
  "$schema": "https://json-schema.org/draft/2020-12/schema",
  "$id": "katalog-item.schema.json",
  "title": "KatalogItem",
  "description": "Vertrag 4: Möbel-/Objektkatalog (Stammdaten). Box-Platzhalter mit Auto-Upgrade: ohne gltfRef rendert der Viewer eine Box aus masse; Platzierungen referenzieren nur die ID.",
  "type": "object",
  "additionalProperties": false,
  "required": [
    "id",
    "schemaVersion",
    "name",
    "kategorie",
    "funktionsTyp",
    "roomTypes",
    "gewerk",
    "masse",
    "assetStatus",
    "priorityClass",
    "achsenTags",
    "attributTags",
    "anschluesse",
    "relationalRules",
    "preis"
  ],
  "properties": {
    "id": { "$ref": "#/$defs/uuid" },
    "schemaVersion": { "$ref": "#/$defs/semver" },
    "name": { "type": "string", "minLength": 1 },
    "kategorie": { "type": "string", "minLength": 1 },
    "funktionsTyp": {
      "type": "string",
      "minLength": 1,
      "description": "Funktionaler Typ, auf den Regeln matchen (z.B. wc, lavabo, dusche, herd, sofa)."
    },
    "roomTypes": {
      "type": "array",
      "minItems": 1,
      "items": { "enum": ["bad", "kueche", "wohnen", "schlafen", "essen", "flur", "sonstig"] }
    },
    "gewerk": {
      "enum": [
        "sanitaer",
        "elektro",
        "schreiner",
        "maler",
        "plattenleger",
        "bodenleger",
        "heizung",
        "lueftung",
        "kueche",
        "moebel",
        "baumeister"
      ]
    },
    "masse": {
      "type": "object",
      "additionalProperties": false,
      "required": ["w", "d", "h"],
      "properties": {
        "w": { "type": "number", "exclusiveMinimum": 0 },
        "d": { "type": "number", "exclusiveMinimum": 0 },
        "h": { "type": "number", "exclusiveMinimum": 0 }
      }
    },
    "gltfRef": { "type": "string" },
    "modell3d": {
      "type": "string",
      "pattern": "^[a-z0-9-]+$",
      "description": "3D-Bausatz-Variante für den Viewer (z.B. wc-wandhaengend, lavabo-aufsatz). Fehlt es, greift der Standard-Bausatz des funktionsTyp; für spätere echte Assets bleibt gltfRef zuständig."
    },
    "usdzRef": {
      "type": "string",
      "description": "AR-Einzelobjekt-Vorschau (Quick Look), Stretch."
    },
    "assetStatus": { "enum": ["placeholder", "modeled"] },
    "priorityClass": {
      "enum": ["P1", "P2", "P3"],
      "description": "P1 Pflicht/Anschluss · P2 Funktion · P3 Ergänzung (Gestaltungs-Engine)."
    },
    "objektEbene": {
      "enum": ["haupt", "ergaenzung"],
      "description": "Objekt-Ebenen-Modell (ADR-0014): «haupt» = raumprägend (Sofa, Esstisch, WC, Küchenzeile …), zuerst gewählt; «ergaenzung» = ergänzt ein Haupt-Objekt (Stuhl zum Esstisch, Couchtisch zum Sofa …). Optional/additiv – fehlt es, gilt das Item als eigenständig (eine Gruppe, keine Anker-Pflicht). Orthogonal zu priorityClass (Auswahl-Semantik vs. Platzierungs-Konkurrenz)."
    },
    "ankerTyp": {
      "type": "string",
      "minLength": 1,
      "description": "Nur bei objektEbene=ergaenzung: funktionsTyp des Haupt-Objekts, an dem die Ergänzung hängt (z.B. «esstisch» für Stühle). Harte Kontrolle: die Ergänzung ist nur wählbar, wenn ein Haupt-Objekt dieses funktionsTyps gewählt ist. Fehlt es, ist die Ergänzung frei wählbar (kein Anker)."
    },
    "maxAnzahl": {
      "type": "integer",
      "minimum": 1,
      "maximum": 6,
      "default": 1,
      "description": "Obergrenze der Instanzen dieses Items in einem Raum (z.B. Stuhl 6, Barhocker 4). Default 1 (Einzelstück). Der Kurator/die Baseline wählt anzahl ≤ maxAnzahl; das Platz-Budget begrenzt zusätzlich."
    },
    "mount": { "enum": ["boden", "wand"], "description": "Host-Bindung; Default boden." },
    "mountHeightRange": {
      "type": "object",
      "additionalProperties": false,
      "required": ["min", "max"],
      "properties": {
        "min": { "type": "number", "minimum": 0 },
        "max": { "type": "number", "minimum": 0 }
      },
      "description": "Erlaubte Montagehöhe (Unterkante bzw. Oberkante je Konvention der Regel) bei mount=wand."
    },
    "achsenTags": {
      "type": "object",
      "additionalProperties": { "type": "number", "minimum": -1, "maximum": 1 }
    },
    "farbVarianten": {
      "type": "array",
      "items": { "$ref": "#/$defs/farbSlug" },
      "minItems": 1,
      "maxItems": 6,
      "uniqueItems": true,
      "description": "Wählbare Farbvarianten des generischen Objekts; erste = Default-Optik. Grundlage für KI-Farbwahl und UI-Picker (nur solange Eigen-Objekte, keine Hersteller-Assets). Obergrenze 6 (war 4): generische Möbel wirken sonst austauschbar – mehr wählbare Töne je Objekt sind der günstigste Hebel gegen «immer dasselbe»."
    },
    "attributTags": {
      "type": "array",
      "items": { "type": "string", "pattern": "^[a-z0-9-]+:[a-z0-9-]+$" }
    },
    "anschluesse": {
      "type": "array",
      "items": { "enum": ["wasser", "abwasser", "elektro", "starkstrom", "lueftung", "heizung"] }
    },
    "relationalRules": {
      "type": "array",
      "items": {
        "type": "string",
        "description": "Mini-Grammatik, z.B. near:lavabo:1.2 – final fixiert beim Solver-Bau (M3)."
      }
    },
    "normProfileVariante": { "enum": ["ch55", "eu60"] },
    "bkpCode": { "type": "string" },
    "ebkpCode": { "type": "string" },
    "npkRef": { "type": "string" },
    "preis": {
      "type": "object",
      "additionalProperties": false,
      "required": ["value", "currency", "stand", "quelle", "bandbreitePct"],
      "properties": {
        "value": { "type": "number", "minimum": 0 },
        "currency": { "const": "CHF" },
        "stand": { "type": "string", "format": "date" },
        "quelle": { "type": "string", "minLength": 1, "description": "Provenance-Pflicht." },
        "bandbreitePct": { "type": "number", "minimum": 0 }
      }
    }
  },
  "$defs": {
    "uuid": { "type": "string", "format": "uuid" },
    "semver": { "type": "string", "pattern": "^\\d+\\.\\d+\\.\\d+$" },
    "farbSlug": {
      "description": "Farbwelt der Katalog-Items (additiv erweiterbar, minor). Gruppiert: Neutraltöne, Holz, Metall/Stein, Farbakzente. Reihenfolge ist stabil – der Client leitet daraus die Picker-Sortierung ab.",
      "enum": [
        "weiss",
        "creme",
        "sand",
        "beige",
        "taupe",
        "hellgrau",
        "warmgrau",
        "anthrazit",
        "schwarz",
        "esche-hell",
        "eiche-hell",
        "eiche-natur",
        "nussbaum",
        "wenge",
        "buche",
        "chrom",
        "edelstahl",
        "schwarzstahl",
        "messing",
        "kupfer",
        "beton",
        "naturstein-hell",
        "marmor-weiss",
        "salbei",
        "graugruen",
        "olive",
        "petrol",
        "blaugrau",
        "dunkelblau",
        "terracotta",
        "rostrot",
        "senf",
        "bordeaux"
      ]
    }
  }
}
